{
  "format": "atlas-intake",
  "version": 1,
  "source": "vera-example",
  "batch": "2026-07-20-001",
  "records": [
    {
      "kind": "encounter",
      "date": "2026-07-18",
      "target": {"id": "material:fastapi-tutorial"},
      "depth": "read"
    },
    {
      "kind": "artifact",
      "date": "2026-07-19",
      "type": "code-answer",
      "text": "Vera Example implemented an idempotent path-operation answer and checked the retry behavior.",
      "refs": [
        {"id": "concept:rest-api"},
        {"id": "concept:idempotency"}
      ],
      "evidence_strength": "applied"
    },
    {
      "kind": "question",
      "date": "2026-07-20",
      "text": "Which retry boundary should the next Vera Example probe isolate?",
      "refs": [
        {"id": "artifact:vera-example-2026-07-20-001-1"},
        {"id": "concept:idempotency"}
      ]
    }
  ]
}
